{"artifact_refs":["sscm:file:run:mission-sscm-01a-live-4:artifacts/coordinator-instruction.json:sha256:b76f8290800fc7811e68e41ef4b87cbcb3a5cacd2a246b331657adbc2e091520","sscm:receipt:run:mission-sscm-01a-live-4:artifacts/coordinator-run.json:sha256:5a2ce2b673fd3153d4b49ada29af1de206460ab62e3c7272153721eddf805edc","sscm:file:run:mission-sscm-01a-live-4:artifacts/implementer-result.json:sha256:c90dfcedd737ab5196783f052cd10a4acfe7b0b3179dca6452d6f1baf8ddb703","sscm:receipt:run:mission-sscm-01a-live-4:artifacts/implementer-run.json:sha256:438716994678b4850df3b059cc8b855a460f04a504399b9c061ea180b1bd99df","sscm:file:run:mission-sscm-01a-live-4:artifacts/host-candidate-verification.json:sha256:d42b36119bf70be3d81fa1750e787d699d0fb83faf631258a6f73f304cd74670","sscm:revision:git:3de5b82552f39d6c319f5171ed22911b4ca89d75","sscm:review:run:mission-sscm-01a-live-4:artifacts/reviewer-result.json:sha256:a9c3317a0973f9be5925b4c9b6dad6ebb8c093da4162a3a11bed127202b3c9c6","sscm:receipt:run:mission-sscm-01a-live-4:artifacts/reviewer-run.json:sha256:421a82f78b99e23a8f5c49f8226eff37506f9a8c90b84cd1cee80de7043a36b2","sscm:file:run:mission-sscm-01a-live-4:artifacts/host-review-verification.json:sha256:917b1115a577be7583f6691987cbfcb51af15e1a715bccb91c89ddf5eed6a4a9"],"authority":"NONE","completed_at":"2026-09-07T03:07:28.656Z","evidence_refs":["sscm:event:evt-8b805f19-ff40-4770-a461-f108cac6046e:sha256:9bd6ef0fbacfcc25c1108a2fbd02acab1eb5ae456f59b9a762275182abbc76e3","sscm:event:evt-7988ea36-623a-4d3d-80b8-f20fa8641c20:sha256:a6608a0a983282ba1f32c3ec8524e827bab40ee8cf8af69e5d5d1d2f32713484","sscm:event:evt-f5681891-230f-4b85-ae99-64992ba98eb4:sha256:6b84ea19b84cde0d8689e1810e84f2fff854de84cf74d78601af0761dff940de","sscm:event:evt-53a220a4-a922-4f1c-981d-07d403c44942:sha256:e45ef4c633ee0bdc053032f779c66eadc139d9f786e61af512828a3d5a6c4cf0","sscm:event:evt-dfa24885-0143-47a4-967c-7cf526842a71:sha256:8e395e0f818a6418391c0fbd09598bf7ec0545cf220e22384fb6967a2fa7deca","sscm:event:evt-c26c26a5-7818-4ad6-a300-5966c48e8b8a:sha256:87542b4f4a34d226d78cbde518e8bcc29a3f5a0a1a2bac135a9b0aaaa53af65b","sscm:event:evt-643c3f48-ddd4-4dd0-9e15-ab602e320687:sha256:b0b5050031f6f96d6c40faef8c3f24ddc17fcf6499ee12d2807a77fb23a21a30","sscm:event:evt-1d9269cb-17e1-4258-ad79-a2144e238030:sha256:4684017b9494c06e532d48516ff4665bc00f06412c9911b373547770b69e00fb","sscm:projection:sha256:4f9c87f8e2bc6cb7597d2a9ce7fbc50999df08db0b3b4610bd92bccc50a60214"],"experience_id":"sscm:exp:f348d0bb05477a3b69adeef3e447f281","outcome":"SUCCEEDED","procedure_candidate_ref":null,"producer":{"agent":"sscm:roster:executor:claude-code+executor:codex","harness":"sscm:mission-controller","model":null,"runtime":"sovereign.sscm@0.1.0"},"schema_version":"sovereign.experience.v0.1","scope_ref":"sscm:mission:mission-sscm-01a-live-4","started_at":"2026-09-07T03:06:06.801Z","task_class":"sscm.dogfood.artifact-bound-handoff","training_candidate_ref":null}
