{"artifact_refs":["sscm:file:run:mission-sscm-01c-live-1:artifacts/coordinator-instruction.json:sha256:69380ee7159e62a8e1f38e8f44db798c65405ce77947071495504106e76a1fc8","sscm:receipt:run:mission-sscm-01c-live-1:artifacts/coordinator-run.json:sha256:7068b00651b09c4fadda06fef72556b57d13a0949a6f35189e7d2656c020129b","sscm:file:run:mission-sscm-01c-live-1:artifacts/implementer-result.json:sha256:8df99af06592bc0710ff585d3a5ce5d98138e427c29d4ab6ba4c91b3bcde3f64","sscm:receipt:run:mission-sscm-01c-live-1:artifacts/implementer-run.json:sha256:d1c260a52a62de0f06d1caffab9a6ff2f94c9b9581f9b7cdb8f4f1e0942a85e2","sscm:file:run:mission-sscm-01c-live-1:artifacts/host-verification-candidate-1.json:sha256:fd5ec3c751760ca1f31438e55e4424d11e2d6bb416d8c4225e725b9ef471d455","sscm:revision:git:6edb3a2ac4dd1ce7a2595fe47c5ba8d8c7a47f21","sscm:test_result:run:mission-sscm-01c-live-1:artifacts/evaluation-1.json:sha256:17ae6f3b26d4452b0e3f631741e071f80a80270a7b792825bf8fe5cc0ce0dc54","sscm:receipt:run:mission-sscm-01c-live-1:artifacts/evaluation-1-receipt.json:sha256:c64be5fc226a354cb8f249ff30667f47bc08cb9a23bb70047362827e89be77c7","sscm:file:run:mission-sscm-01c-live-1:artifacts/repair-instruction.json:sha256:1940a967020c327bcd4939f642ac95d6676131ce588090f97a73d2918341abfe","sscm:file:run:mission-sscm-01c-live-1:artifacts/repair_implementer-result.json:sha256:780f7d6f0e16bfd148d6cab2bab2b999212bee009dbdce3b596d3adf7f28dcdc","sscm:receipt:run:mission-sscm-01c-live-1:artifacts/repair_implementer-run.json:sha256:76ffba15db7d9d12c2ed6831b5a96630edb7c664a52d076517bed5cdf4dbc5aa","sscm:file:run:mission-sscm-01c-live-1:artifacts/host-verification-candidate-2.json:sha256:518dc4e0664613b6cbb68c6e63f75176ed734b227ca3d3558350279c9bece14c","sscm:revision:git:2a93e1d66b7a3c3edb4dc069e0fe2ff5c3d97f06","sscm:test_result:run:mission-sscm-01c-live-1:artifacts/evaluation-2.json:sha256:822b25265c43b8ffea0a60b5b03fb0e07a8e3c087cf66bba5befd3d6033c765a","sscm:receipt:run:mission-sscm-01c-live-1:artifacts/evaluation-2-receipt.json:sha256:cc6f2dfafd12797807085563d744425a35d04b270d14fea7466b3757beaca1d9","sscm:review:run:mission-sscm-01c-live-1:artifacts/reviewer-result.json:sha256:ca34bb86cdc51e45244ca422649eec6bca2a9a35f9f55c60343c6b977452d911","sscm:receipt:run:mission-sscm-01c-live-1:artifacts/reviewer-run.json:sha256:0fdf8f7ff559c1ae540512214a8c892bc33439d56ad730ea9eae242280233a14","sscm:file:run:mission-sscm-01c-live-1:artifacts/host-review-verification.json:sha256:fc4373307f3b4a0af52741db9f8d9d43ef9f57e0abd1248961221a733a14fab5"],"authority":"NONE","completed_at":"2026-09-07T18:12:16.858Z","evidence_refs":["sscm:event:evt-84665e50-fa34-410b-8668-18706b262382:sha256:13f3afd974030c2a825eab7900d7e18ec945a56c44f1a42f1a14191860688e56","sscm:event:evt-9e6e09cf-64d9-437e-803b-65f47775a0a9:sha256:e7b00acc6b16f910a32ee69ccb8af08094e78157a7cd5d8f4aff395f90fa8b61","sscm:event:evt-b1574bbf-6d72-4094-820d-bab0a2c1a3a2:sha256:b1c6d8637dba974852b9838799b0365e142ffea561feae768fc20a25287c7811","sscm:event:evt-0b623960-a2a3-4ecf-bce9-38c37d2df57f:sha256:8443d3cf99319d91f97944ac27bab8290b81c7945e0f4afc4659de54dddfa6d8","sscm:event:evt-5168f63d-0adc-48d3-b3ec-34a1badf5054:sha256:e41862c6fb7121f313dbb67e42f34effc27b58ce257a506b4c90ace61b5a4866","sscm:event:evt-0c442ed4-aa42-406a-988a-230350c4be1d:sha256:4d457e3a53f424ea1f745a8f3de016b03dfc5cf69e3f7bedd284f921632cd3d3","sscm:event:evt-426ad2f1-372b-418d-8d68-c61884902a6a:sha256:88bac34dca0071a5921f524d0929ec34b4081c7155e627aee5b4fd055081ad30","sscm:event:evt-25842b8a-ae7f-4d67-9e7e-ae5abe6c5bd1:sha256:7dfaf42a1d87d6f05710c876beb2908bd70d82f9d1770ee9173cbf17f62b78d0","sscm:event:evt-983f793e-1951-430a-81a2-3b4b550e1f62:sha256:279b288e1831577931532e548c7787e08a6964fa95b671863278a49f4e2042ba","sscm:event:evt-a58af683-7ba6-400b-9966-ad76587b6b0e:sha256:8c13c149c6051f1455398a0250d109b4794ed7dd51b2733b4d5be01c2c33f3e6","sscm:event:evt-613dcb77-5acf-4788-a1f6-f9b0bfcaa8d6:sha256:8ef2f221947bc320bdb408eff19ab1d24012670cd346a822edc84ef1ad6a5369","sscm:event:evt-4a745122-9e9f-440c-9f5e-c4712029ba64:sha256:912c4160357dccb3b3c2ccce61f236599d2b26211fe89bfdde1fdd88740ea74e","sscm:event:evt-c0696f39-461e-4c71-81e1-525c035040ae:sha256:77279b473d3cc57bf52f87faaab831a0a46e6a7851a01c793fcfc53a9960a49e","sscm:event:evt-0bd2c183-1547-4a17-9dab-8ce2cf43f805:sha256:761b555946a0e8744ad108ab62631ba7c3cd4b6c6600ad7fe8f820ca026cce8f","sscm:projection:sha256:91d02c1804ae6fe936b76756e186fd2ebfc818bd57d431470b9d62e1ac5bac3a"],"experience_id":"sscm:exp:bcab9e337d47fad5c1d98288975cad0a","outcome":"SUCCEEDED","procedure_candidate_ref":null,"producer":{"agent":"sscm:roster:executor:claude-code+executor:codex","harness":"sscm:mission-controller","model":null,"runtime":"sovereign.sscm@0.1.0"},"schema_version":"sovereign.experience.v0.1","scope_ref":"sscm:mission:mission-sscm-01c-live-1","started_at":"2026-09-07T18:01:18.916Z","task_class":"sscm.dogfood.artifact-bound-handoff","training_candidate_ref":null}
