{"artifact_refs":["sscm:file:run:mission-sscm-01b-live-2:artifacts/coordinator-fanout-plan.json:sha256:62c914f1ebd25e21fd065dc2398be4da37e20bb2867499cc6617ae185b85f897","sscm:receipt:run:mission-sscm-01b-live-2:artifacts/coordinator-run.json:sha256:84cc05a3f7668a7fcb985a5b755253aa11f716a900ba3ca127592e5026326de6","sscm:file:run:mission-sscm-01b-live-2:artifacts/worker_b-result.json:sha256:edf5caa41b732e30b8e460976f1be27dca3daa3a1889eff11ae700f3d504adc9","sscm:receipt:run:mission-sscm-01b-live-2:artifacts/worker_b-run.json:sha256:5cd985bf25d51dc171738955a7c8c10172e5d6da3339d9cb9165f3d2d6293488","sscm:file:run:mission-sscm-01b-live-2:artifacts/worker_a-result.json:sha256:bd4ba98346eb37ca48073612c176d150aa17c822a0066e877f591c805d028c7d","sscm:receipt:run:mission-sscm-01b-live-2:artifacts/worker_a-run.json:sha256:e6a8386522dcebcb92a552c7486c68deb0f9d90ace75b08683c2b47d4989b991","sscm:file:run:mission-sscm-01b-live-2:artifacts/host-verification-worker_b.json:sha256:b9a03e42aa8436220b811dca07f1a069b63ee62a19fb6aa76fb763b7f9447d78","sscm:revision:git:6a8c1a21f45c8e1a827fe64adc88ee051597c4aa","sscm:file:run:mission-sscm-01b-live-2:artifacts/host-verification-worker_a.json:sha256:068d31218d0fdb014c1199cab707dc9b8b5b11912332e26c6a1163c1f5fcd7a8","sscm:revision:git:7531f8031097dcec47100da161809eede33d763c","sscm:receipt:run:mission-sscm-01b-live-2:artifacts/integration-receipt.json:sha256:ee436bc048ef266b97c076a3619a9db717b416ecf65b0c823e3272921c567ee0","sscm:revision:git:916826117fcd3cdf729966ebf7db5c063ed65583","sscm:review:run:mission-sscm-01b-live-2:artifacts/reviewer-result.json:sha256:70135aeeb2bb06c5606acfaff9c3910f41fc2ed7af43250ab69421a9e1d88679","sscm:receipt:run:mission-sscm-01b-live-2:artifacts/reviewer-run.json:sha256:c876c572c9bd99f906824e46067683a36be450414c5cbbf5d7efbe7e18ee516f","sscm:file:run:mission-sscm-01b-live-2:artifacts/host-review-verification.json:sha256:a2ffce942fd1dd8c9dfeecba6b3ac6fe79488f4b554522e800b6d797c731c81c"],"authority":"NONE","completed_at":"2026-09-07T05:07:11.341Z","evidence_refs":["sscm:event:evt-821f30d1-eb0b-4acb-b71f-9458ff4874a3:sha256:c61a60db83a51f92300e30d47629caa9acbff0f1b0154c3fce0a134f70647447","sscm:event:evt-be458498-9ff5-4807-aa93-2afd243ca754:sha256:1caf6cf89099e2795f2e88d962fed26f99e6cf54676dbdb475871b6f603c598d","sscm:event:evt-ee87b5d4-8d74-4784-9c2c-3e87d3b4d63f:sha256:aa9480202995ea358c0c5c8bffba9ae55696584d208fbf081aff341e11461128","sscm:event:evt-faf522d0-3ca8-4656-8677-a615602dc7a2:sha256:ac0bd0b5f8f102271396e2446f30a767abdb67d52339cf63d932b634a8304700","sscm:event:evt-ff93e230-978e-43d7-a445-f8a92c610521:sha256:968178b740f2986e53e2c5edbe745c04ed2fe68bda2821b39a0ef5be8594eb2c","sscm:event:evt-2470049c-ca07-4f35-ae06-a3894a19ef35:sha256:13e3923eb61537da99b6e2c99ad5217e30ed74b323d41c53f89e44061b75eab9","sscm:event:evt-3b84d81e-9b0b-4162-9cf7-6d16364533ca:sha256:2630e2029c986f15a79ec2e31c14f86e31774f1ba6e71778f40dd4f3dacb5d68","sscm:event:evt-ce73dbf6-df47-4e71-ae71-cb7fa30958cb:sha256:5aee24c4832813c80228aff4480219f1f93667441e16439146bc99afeb62feba","sscm:event:evt-4c6ecdc3-d35f-4ce1-a5a2-030b36d6a8fb:sha256:c127284d2a8395dbddc6ba67ea800fe6a9e546344969d51858bb90b81b850a25","sscm:event:evt-3d47f2bb-ac74-486d-bd0f-872acd55eb00:sha256:9964caac3c47363466d2ad9780cbe56db0e6886dd7e665a7be7c4e6406c54b4d","sscm:event:evt-484bde15-8206-4bf5-b51b-977b8ac315d6:sha256:5ad846bdce54a5653f5072a1d12725cfe7168e925b69fd684c43a8ff57d958d6","sscm:event:evt-108921d2-bf2c-47fc-9ba5-1463657c29ee:sha256:1e809e8b37e478390d35da4d2086aa2ef2e5375d9683e764b34eca5c7d869c53","sscm:event:evt-588a61ab-1404-40d5-b35d-976d4af6601b:sha256:f99ccc356a8efe4b2f7434d75689ac3d04a71d42d851e06850fa4bb017892ba2","sscm:projection:sha256:2e1347a2d1848a4846d3d1067bf86a662a577dcb0e76d777ec4e10e343860184"],"experience_id":"sscm:exp:4916a56a018cac920cbb057da6209387","outcome":"SUCCEEDED","procedure_candidate_ref":null,"producer":{"agent":"sscm:roster:executor:claude-code+executor:codex","harness":"sscm:mission-controller","model":null,"runtime":"sovereign.sscm@0.1.0"},"schema_version":"sovereign.experience.v0.1","scope_ref":"sscm:mission:mission-sscm-01b-live-2","started_at":"2026-09-07T05:05:02.831Z","task_class":"sscm.dogfood.artifact-bound-handoff","training_candidate_ref":null}
